{
  "$schema": "https://json-schema.org/draft/2020-12/schema",
  "$id": "https://a1-specforge.dev/schemas/docs-product-index.schema.json",
  "title": "docs/product/index.json — schema v1.2",
  "description": "Machine-owned manifest generated from docs/product/ROADMAP.md and docs/product/features/<###>-<slug>/feature.md, plus (v1.1, optional) docs/product/VISION.md and docs/product/audits/<date>-<focus>.md, plus (optional, spec 006 FR-001) `project.profile`. See docs/product/SCHEMA.md section 3 for the authoritative prose contract; field names here are identical. `vision`/`audits`/`project.profile` are OPTIONAL properties (not in `required`) so a v1-only document (no VISION.md, no audits/, no profile) that omits them entirely still validates (FR-016) — when present, `vision`/`audits` follow the shapes in $defs/vision and $defs/audit.",
  "type": "object",
  "additionalProperties": false,
  "required": ["schema_version", "generated", "project", "milestones", "features", "next", "cursor"],
  "properties": {
    "schema_version": {
      "type": "integer",
      "const": 1,
      "description": "Schema version of this manifest. Current: 1."
    },
    "generated": {
      "type": "string",
      "format": "date-time",
      "description": "ISO 8601 UTC timestamp of when this file was generated."
    },
    "project": {
      "type": "object",
      "additionalProperties": false,
      "required": ["id", "title", "status"],
      "properties": {
        "id": {
          "type": "string",
          "pattern": "^[a-z0-9]+(-[a-z0-9]+)*$",
          "description": "Kebab-case project identifier, matches ROADMAP.md frontmatter `project`."
        },
        "title": {
          "type": "string",
          "minLength": 1,
          "description": "Human product/project title, English."
        },
        "status": {
          "type": "string",
          "enum": ["active", "paused", "done"]
        },
        "profile": {
          "type": "string",
          "enum": ["kritis"],
          "description": "OPTIONAL (spec 006 FR-001): the KRITIS/NIS2 profile lane, mirrored from ROADMAP.md frontmatter `profile:` when present. Absent entirely when ROADMAP.md carries no `profile:` key (this property is not in `required`); schema v1 output is unchanged (FR-008)."
        }
      }
    },
    "milestones": {
      "type": "array",
      "items": { "$ref": "#/$defs/milestone" }
    },
    "features": {
      "type": "array",
      "items": { "$ref": "#/$defs/feature" }
    },
    "next": {
      "type": ["string", "null"],
      "description": "Recommended next feature id, or null. References a features[].id."
    },
    "cursor": {
      "type": ["string", "null"],
      "description": "Pagination/resume cursor for consumers walking the feature list incrementally. Same id space as `next`, may differ from it. Null when there is nothing to resume."
    },
    "vision": {
      "$ref": "#/$defs/vision",
      "description": "v1.1, OPTIONAL: null when docs/product/VISION.md is absent; otherwise mirrors its frontmatter (FR-014). Absent entirely from a strict v1-only document is also valid (this property is not in `required`)."
    },
    "audits": {
      "type": "array",
      "items": { "$ref": "#/$defs/audit" },
      "description": "v1.1, OPTIONAL: one entry per docs/product/audits/<date>-<focus>.md file, [] when none exist (FR-015). Absent entirely from a strict v1-only document is also valid (this property is not in `required`)."
    },
    "modules": {
      "type": "array",
      "items": { "$ref": "#/$defs/module" },
      "description": "v1.2, OPTIONAL: one entry per module in use (spec 023 FR-011), in `modules:` list order, else first appearance in milestones. Absent entirely when no milestone carries a `module` (this property is not in `required`)."
    }
  },
  "$defs": {
    "milestone": {
      "type": "object",
      "additionalProperties": false,
      "required": ["id", "title", "status", "target"],
      "properties": {
        "id": {
          "type": "string",
          "pattern": "^[a-z0-9]+(-[a-z0-9]+)*$",
          "description": "Stable kebab-case slug, never recycled."
        },
        "title": {
          "type": "string",
          "minLength": 1
        },
        "status": {
          "type": "string",
          "enum": ["done", "in-progress", "planned"]
        },
        "target": {
          "type": ["string", "null"],
          "pattern": "^[0-9]{4}-[0-9]{2}$",
          "description": "Target month YYYY-MM, or null if unscheduled."
        },
        "module": {
          "type": ["string", "null"],
          "pattern": "^[a-z0-9]+(-[a-z0-9]+)*$",
          "description": "v1.2, OPTIONAL: module slug of this milestone, or null for an untagged milestone. Emitted on every milestone only when at least one module is in use; absent otherwise."
        }
      }
    },
    "module": {
      "type": "object",
      "additionalProperties": false,
      "required": ["id", "milestones", "cursor"],
      "properties": {
        "id": {
          "type": "string",
          "pattern": "^[a-z0-9]+(-[a-z0-9]+)*$",
          "description": "Module slug."
        },
        "milestones": {
          "type": "array",
          "items": { "type": "string" },
          "description": "Ids of the milestones tagged with this module, in ROADMAP.md order."
        },
        "cursor": {
          "type": ["string", "null"],
          "description": "Module cursor: first open feature of the module whose depends_on are all done; null if none. Derived, never stored in ROADMAP.md."
        }
      }
    },
    "feature": {
      "type": "object",
      "additionalProperties": false,
      "required": [
        "id", "milestone", "title", "status", "stage",
        "depends_on", "started", "finished", "spec_path", "plan_path"
      ],
      "properties": {
        "id": {
          "type": "string",
          "pattern": "^[0-9]{3}-[a-z0-9]+(-[a-z0-9]+)*$",
          "description": "3-digit zero-padded sequence + kebab-slug, never recycled."
        },
        "milestone": {
          "type": "string",
          "description": "Must reference a milestones[].id in this same document."
        },
        "title": {
          "type": "string",
          "minLength": 1
        },
        "status": {
          "type": "string",
          "enum": ["done", "in-flight", "planned", "cancelled"]
        },
        "stage": {
          "type": ["string", "null"],
          "enum": [null, "started", "complete", "review", "verify", "merge", "origin-cleanup", "done"],
          "description": "Lifecycle stage while in-flight; null when not in-flight. Reuses CODE_SCOPE_STAGES (_shared/a1-tools.cjs)."
        },
        "depends_on": {
          "type": "array",
          "items": { "type": "string" },
          "description": "Array of feature ids this feature depends on."
        },
        "started": {
          "type": ["string", "null"],
          "pattern": "^[0-9]{4}-[0-9]{2}-[0-9]{2}$",
          "description": "Date work began, YYYY-MM-DD, or null."
        },
        "finished": {
          "type": ["string", "null"],
          "pattern": "^[0-9]{4}-[0-9]{2}-[0-9]{2}$",
          "description": "Date work completed, YYYY-MM-DD, or null."
        },
        "spec_path": {
          "type": ["string", "null"],
          "description": "Repo-relative path to the feature's spec doc, or null."
        },
        "plan_path": {
          "type": ["string", "null"],
          "description": "Repo-relative path to the feature's wave-plan doc, or null."
        }
      }
    },
    "vision": {
      "type": ["object", "null"],
      "description": "v1.1: null when docs/product/VISION.md is absent (FR-014).",
      "additionalProperties": false,
      "required": ["path", "updated", "pillars"],
      "properties": {
        "path": {
          "type": "string",
          "description": "Repo-relative path to VISION.md, e.g. \"docs/product/VISION.md\"."
        },
        "updated": {
          "type": ["string", "null"],
          "pattern": "^[0-9]{4}-[0-9]{2}-[0-9]{2}$",
          "description": "Mirrors VISION.md frontmatter `updated`, YYYY-MM-DD."
        },
        "pillars": {
          "type": "array",
          "description": "Mirrors VISION.md frontmatter `pillars[]` verbatim.",
          "items": {
            "type": "object",
            "additionalProperties": false,
            "required": ["id", "title", "summary"],
            "properties": {
              "id": { "type": "string" },
              "title": { "type": "string" },
              "summary": { "type": "string" }
            }
          }
        }
      }
    },
    "audit": {
      "type": "object",
      "description": "v1.1: one entry per docs/product/audits/<date>-<focus>.md file (FR-015).",
      "additionalProperties": false,
      "required": ["path", "date", "focus", "verdict", "counts", "open", "fixed", "last_validated"],
      "properties": {
        "path": {
          "type": "string",
          "description": "Repo-relative path to the audit file, e.g. \"docs/product/audits/2026-07-13-general.md\"."
        },
        "date": {
          "type": ["string", "null"],
          "pattern": "^[0-9]{4}-[0-9]{2}-[0-9]{2}$",
          "description": "Mirrors the audit's frontmatter `date`."
        },
        "focus": {
          "type": ["string", "null"],
          "enum": ["general", "security", "architecture", "quality", "onboarding", null],
          "description": "Mirrors the audit's frontmatter `focus`."
        },
        "verdict": {
          "type": ["string", "null"],
          "description": "Mirrors the audit's frontmatter `verdict`."
        },
        "counts": {
          "type": "object",
          "additionalProperties": false,
          "required": ["blocker", "major", "minor"],
          "description": "Mirrors the audit's frontmatter `counts` (blocker/major/minor, all findings regardless of status).",
          "properties": {
            "blocker": { "type": "integer" },
            "major": { "type": "integer" },
            "minor": { "type": "integer" }
          }
        },
        "open": {
          "type": "integer",
          "description": "Derived: count of findings[] with status \"open\"."
        },
        "fixed": {
          "type": "integer",
          "description": "Derived: count of findings[] with status \"fixed\". Findings with status \"obsolete\"/\"accepted\" count toward neither open nor fixed."
        },
        "last_validated": {
          "type": ["string", "null"],
          "pattern": "^[0-9]{4}-[0-9]{2}-[0-9]{2}$",
          "description": "Mirrors the audit's frontmatter `last_validated`."
        }
      }
    }
  }
}
