{
  "schema_version": 1,
  "generated": "MASKED",
  "project": {
    "id": "golden-b",
    "title": "golden-b — Roadmap",
    "status": "active"
  },
  "milestones": [
    {
      "id": "m1-first",
      "title": "First Milestone",
      "status": "in-progress",
      "target": "2026-08"
    },
    {
      "id": "m2-second",
      "title": "Second Milestone",
      "status": "planned",
      "target": "2026-09"
    }
  ],
  "features": [
    {
      "id": "001-first-feature",
      "milestone": "m1-first",
      "title": "First Feature",
      "status": "in-flight",
      "stage": "started",
      "depends_on": [],
      "started": "2026-07-14",
      "finished": null,
      "spec_path": null,
      "plan_path": null
    },
    {
      "id": "002-second-feature",
      "milestone": "m1-first",
      "title": "Second Feature",
      "status": "planned",
      "stage": null,
      "depends_on": [
        "001-first-feature"
      ],
      "started": null,
      "finished": null,
      "spec_path": null,
      "plan_path": null
    },
    {
      "id": "003-third-feature",
      "milestone": "m2-second",
      "title": "Third Feature",
      "status": "planned",
      "stage": null,
      "depends_on": [],
      "started": null,
      "finished": null,
      "spec_path": null,
      "plan_path": null
    }
  ],
  "next": "001-first-feature",
  "cursor": "001-first-feature",
  "vision": {
    "path": "docs/product/VISION.md",
    "updated": "2026-07-13",
    "pillars": [
      {
        "id": "reliability",
        "title": "Reliability",
        "summary": "The product never loses user data."
      }
    ]
  },
  "audits": [
    {
      "path": "docs/product/audits/2026-07-13-general.md",
      "date": "2026-07-13",
      "focus": "general",
      "verdict": "beta-ready, 1 open finding",
      "counts": {
        "blocker": 0,
        "major": 1,
        "minor": 0
      },
      "open": 1,
      "fixed": 0,
      "last_validated": null
    }
  ]
}
